{"$schema":"https://json-schema.org/draft/2020-12/schema","additionalProperties":false,"properties":{"bundleRef":{"maxLength":256,"minLength":1,"type":"string"},"bundleStructuralHash":{"pattern":"^sha256:[0-9a-f]{64}$","type":"string"},"chapters":{"items":{"additionalProperties":false,"properties":{"callbacks":{"items":{"additionalProperties":false,"properties":{"claimRef":{"maxLength":256,"minLength":1,"type":"string"},"deltaKind":{"enum":["NEW_CLAIM","NEW_RELATION","NEW_QUALIFICATION","NEW_CONTRAST","NEW_CONTEXT","NEW_INTEGRATION"],"type":"string"}},"required":["claimRef","deltaKind"],"type":"object"},"maxItems":32,"type":"array"},"chapterRef":{"maxLength":256,"minLength":1,"type":"string"},"narrativeOperation":{"enum":["ESTABLISH","REINFORCE","QUALIFY","CONTRAST","CONTEXTUALIZE","INTEGRATE"],"type":"string"},"paragraphs":{"items":{"additionalProperties":false,"properties":{"claimRefs":{"items":{"maxLength":256,"minLength":1,"type":"string"},"maxItems":32,"type":"array"},"factRefs":{"items":{"maxLength":256,"minLength":1,"type":"string"},"maxItems":64,"type":"array"},"kind":{"enum":["FACT","FRAME","INTERPRETATION","REFLECTION"],"type":"string"},"posture":{"enum":["NONE","SUPPORTED","TENTATIVE"],"type":"string"},"text":{"maxLength":6000,"minLength":1,"type":"string"}},"required":["kind","posture","text","factRefs","claimRefs"],"type":"object"},"maxItems":40,"minItems":1,"type":"array"},"semanticDelta":{"items":{"additionalProperties":false,"properties":{"claimRefs":{"items":{"maxLength":256,"minLength":1,"type":"string"},"maxItems":16,"minItems":1,"type":"array"},"kind":{"enum":["NEW_CLAIM","NEW_RELATION","NEW_QUALIFICATION","NEW_CONTRAST","NEW_CONTEXT","NEW_INTEGRATION"],"type":"string"}},"required":["kind","claimRefs"],"type":"object"},"maxItems":16,"type":"array"},"title":{"maxLength":200,"minLength":1,"type":"string"}},"required":["chapterRef","narrativeOperation","title","paragraphs","semanticDelta","callbacks"],"type":"object"},"maxItems":40,"minItems":1,"type":"array"},"claimGraphStructuralHash":{"pattern":"^sha256:[0-9a-f]{64}$","type":"string"},"contracts":{"items":{"additionalProperties":false,"properties":{"confluencePageId":{"maxLength":64,"minLength":1,"type":"string"},"confluencePageVersion":{"maxLength":64,"minLength":1,"type":"string"},"contractRef":{"maxLength":256,"minLength":1,"type":"string"}},"required":["contractRef","confluencePageId","confluencePageVersion"],"type":"object"},"maxItems":16,"type":"array"},"inputPackageStructuralHash":{"pattern":"^sha256:[0-9a-f]{64}$","type":"string"},"methodNote":{"additionalProperties":false,"properties":{"text":{"maxLength":6000,"minLength":1,"type":"string"},"warningCodes":{"items":{"maxLength":128,"minLength":1,"type":"string"},"maxItems":64,"type":"array"}},"required":["text","warningCodes"],"type":"object"},"planStructuralHash":{"pattern":"^sha256:[0-9a-f]{64}$","type":"string"},"reflectionQuestions":{"items":{"additionalProperties":false,"properties":{"claimRefs":{"items":{"maxLength":256,"minLength":1,"type":"string"},"maxItems":16,"minItems":1,"type":"array"},"text":{"maxLength":1000,"minLength":1,"type":"string"}},"required":["text","claimRefs"],"type":"object"},"maxItems":20,"minItems":1,"type":"array"},"schemaVersion":{"const":"bazodiac-skill-reading.v1","type":"string"},"skillRef":{"maxLength":256,"minLength":1,"type":"string"},"title":{"maxLength":200,"minLength":1,"type":"string"},"visualizationSpecs":{"items":{"additionalProperties":false,"properties":{"claimRefs":{"items":{"maxLength":256,"minLength":1,"type":"string"},"maxItems":32,"type":"array"},"factRefs":{"items":{"maxLength":256,"minLength":1,"type":"string"},"maxItems":64,"type":"array"},"slotId":{"maxLength":256,"minLength":1,"type":"string"},"specId":{"maxLength":256,"minLength":1,"type":"string"}},"required":["specId","slotId","factRefs","claimRefs"],"type":"object"},"maxItems":64,"type":"array"}},"required":["schemaVersion","skillRef","bundleRef","bundleStructuralHash","inputPackageStructuralHash","claimGraphStructuralHash","planStructuralHash","contracts","title","chapters","reflectionQuestions","methodNote","visualizationSpecs"],"type":"object"}
