{
  "schemaVersion": "bazodiac-skill-reading.v1",
  "skillRef": "bazodiac-interpretation-skill@1.1.0",
  "bundleRef": "bazodiac-skill-contract-bundle@1.1.0",
  "bundleStructuralHash": "sha256:9e6762f3cf339f3e03e56d52770629bd30eebe79ab6b7a70cbcc9dbb9ea599c2",
  "inputPackageStructuralHash": "sha256:cb8f2e2a88da4c5dcf4db921551289106f65fa33360668bb9548b24993a31fdc",
  "claimGraphStructuralHash": "sha256:93ff951f8d65bc7a7b9a923d85095941918bb89f89debd4277d9db58582ec27d",
  "planStructuralHash": "sha256:594861d9dd53aed470edb0595b575b81d839dcc1411ccde242d982da523b5d65",
  "contracts": [
    {"confluencePageId": "63012866", "confluencePageVersion": "5", "contractRef": "bazi-method-profile@1.0.0"},
    {"confluencePageId": "57802765", "confluencePageVersion": "2", "contractRef": "confluence:57802765@2"},
    {"confluencePageId": "77561858", "confluencePageVersion": "6", "contractRef": "grounded-reflective-synthesis-lens@1.1.0"},
    {"confluencePageId": "77529091", "confluencePageVersion": "4", "contractRef": "terminology-wording-lexicon@1.1.0"},
    {"confluencePageId": "77266967", "confluencePageVersion": "3", "contractRef": "cross-reading-individuality-contract@1.1.0"}
  ],
  "title": "BaZi-Chart für Variante N (synthetisch)",
  "chapters": [
    {
      "chapterRef": "chapter.sha256:2dd764004829631327fe86c37e6f32d366577b6d20b2483a99942c82f4d128f0",
      "narrativeOperation": "ESTABLISH",
      "title": "Xin als Blickpunkt, die Disruptive Ausgabe als Ausdruck",
      "paragraphs": [
        {
          "kind": "FACT",
          "posture": "NONE",
          "text": "Dein Chart zeigt in der Tagessäule den Himmelsstamm Xin, geschrieben 辛 und ausgesprochen xīn, in der Wandlungsphase Metall. Dieser Stamm ist dein Tagesmeister. Unter ihm steht der Erdzweig Hai, geschrieben 亥 und ausgesprochen hài, dem als Tierbild das Schwein zugeordnet ist. Die Tagessäule ist eine der Säulen deines Charts: Jahr, Monat, Tag und Stunde der Geburt bilden je eine Säule, und jede Säule besteht aus einem Himmelsstamm oben und einem Erdzweig unten. Die Himmelsstämme bilden die sichtbare obere Schicht des Charts. Die Erdzweige bilden die untere Schicht und tragen in sich verborgene Stämme, eine innere Ebene, die nicht an der Oberfläche steht.",
          "factRefs": ["chart.dayMaster.stem", "chart.dayMaster.stemHanzi", "chart.dayMaster.stemPinyin", "chart.dayMaster.element", "chart.pillar.day.branch", "chart.pillar.day.branchHanzi", "chart.pillar.day.branchPinyin", "chart.pillar.day.tier"],
          "claimRefs": []
        },
        {
          "kind": "FRAME",
          "posture": "NONE",
          "text": "Der Tagesmeister ist der Bezugspunkt eines BaZi-Charts. Jede andere Position wird von ihm aus betrachtet: Ob ein Stamm stützt, fordert, auf gleicher Höhe steht oder etwas hervorbringt, ergibt sich erst aus seinem Verhältnis zu Xin. Der Tagesmeister ist kein Persönlichkeitstyp und keine fertige Charakterbeschreibung. Er ist die Stelle, an der die Perspektive des ganzen Charts festgemacht ist, so wie eine Karte erst dann etwas zeigt, wenn der eigene Standort darauf markiert ist. Alle Verhältnisse, die in den übrigen Säulen erscheinen, sind Verhältnisse zu diesem Punkt.",
          "factRefs": ["chart.dayMaster.stem"],
          "claimRefs": ["claim.sha256:dfaed59cf78e966e9a7fa3840b7f86df2d9425b9dba64d7db48dd21ee6d7ad57"]
        },
        {
          "kind": "INTERPRETATION",
          "posture": "SUPPORTED",
          "text": "Dein Chart ordnet sich um Xin. Was die übrigen Säulen tragen, erscheint deshalb nicht als lose Sammlung von Eigenschaften, sondern als eine Reihe von Beziehungen, die alle auf denselben Standpunkt zulaufen. Eine Anforderung ist in diesem Chart eine Anforderung an Xin; etwas, das hervorgebracht wird, geht von Xin aus; eine Stütze ist etwas, das Xin erreicht. Erkennbar wird dieser Blickpunkt etwa in Momenten, in denen eine Lage erst dann Sinn ergibt, wenn klar ist, von welcher Stelle aus auf sie geschaut wird: Dieselbe Situation sieht von einem anderen Standort aus anders aus, und erst der Standort entscheidet, was in ihr fordert, was stützt und was hervortritt. Der Tagesmeister legt diesen Standort für das ganze Chart fest.",
          "factRefs": ["chart.dayMaster.stem"],
          "claimRefs": ["claim.sha256:dfaed59cf78e966e9a7fa3840b7f86df2d9425b9dba64d7db48dd21ee6d7ad57"]
        },
        {
          "kind": "FACT",
          "posture": "NONE",
          "text": "In deiner Monatssäule steht im Himmelsstamm Ren, geschrieben 壬 und ausgesprochen rén, in der Wandlungsphase Wasser. Zum Tagesmeister steht dieser Stamm in der Beziehung Disruptive Ausgabe: Er gehört zu der Phase, die der Tagesmeister hervorbringt. In BaZi bekommt jedes Verhältnis eines Stammes zum Tagesmeister einen eigenen Namen, und diese Namen sind die Sprache, in der das Chart seine Beziehungen ausweist. Im Erdzweig der Tagessäule liegt unter den verborgenen Stämmen ebenfalls Ren, und auch dort steht die Disruptive Ausgabe, wieder als Phase, die der Tagesmeister hervorbringt.",
          "factRefs": ["chart.pillar.month.stem", "chart.pillar.month.stemHanzi", "chart.pillar.month.stemPinyin", "chart.pillar.month.stemElement", "chart.natal.pillar.month.tenGod", "chart.natal.pillar.month.tenGod.elementRelation", "chart.natal.pillar.day.hiddenStem.0.stem", "chart.natal.pillar.day.hiddenStem.0.tenGod", "chart.natal.pillar.day.hiddenStem.0.tenGod.elementRelation"],
          "claimRefs": []
        },
        {
          "kind": "FRAME",
          "posture": "NONE",
          "text": "Die Disruptive Ausgabe gehört in BaZi zur Familie von Ausdruck, Hervorbringen und Differenzierung. Gemeint ist der Weg, auf dem etwas Inneres nach außen tritt und Gestalt annimmt. In dieser Familie steht die Disruptive Ausgabe für die schärfere Ausprägung: einen differenzierenden, kritischen Ausdruck, der an einem bestehenden Rahmen ansetzt, ihn prüft und Unterschiede benennt, statt ihn bloß fortzuführen. Sie beschreibt eine Richtung, in die sich das Hervorgebrachte bewegt, nämlich hin zur Unterscheidung.",
          "factRefs": ["chart.natal.pillar.month.tenGod", "chart.natal.pillar.day.hiddenStem.0.tenGod"],
          "claimRefs": ["claim.sha256:fcbe1320f16008b6ec8dd8139bd287bb9888f409e7aed467210c7df5a6131375"]
        },
        {
          "kind": "INTERPRETATION",
          "posture": "SUPPORTED",
          "text": "Die Disruptive Ausgabe steht in deinem Chart an der Oberfläche der Monatssäule und kehrt im Inneren des Tageszweigs wieder. Differenzierender Ausdruck liegt damit sowohl sichtbar am Himmelsstamm der Monatssäule als auch verborgen im Erdzweig der Säule, in der der Tagesmeister selbst steht. Der Ausdruck ist also kein Zug, der nur nach außen weist; er reicht bis in die unmittelbare Nähe des Bezugspunkts. Das zeigt sich als ein Ausdruck, der nicht beim Weitergeben stehen bleibt, sondern unterscheidet, schärft und an Vorhandenem ansetzt. Erkennbar ist das Muster in Situationen, in denen ein Entwurf vorliegt und der spontane Impuls nicht Zustimmung ist, sondern die Frage, an welcher Stelle er nicht stimmt; oder in Momenten, in denen ein Gedanke erst dann fertig wirkt, wenn er gegen eine bestehende Formulierung abgegrenzt ist.",
          "factRefs": ["chart.natal.pillar.day.hiddenStem.0.tenGod", "chart.natal.pillar.month.tenGod"],
          "claimRefs": ["claim.sha256:fcbe1320f16008b6ec8dd8139bd287bb9888f409e7aed467210c7df5a6131375"]
        },
        {
          "kind": "INTERPRETATION",
          "posture": "SUPPORTED",
          "text": "Die Positionen geben diesem Ausdruck seinen Ort. An der Oberfläche der Monatssäule steht die Disruptive Ausgabe dort, wo ein Stamm offen sichtbar ist; im Tageszweig liegt sie dort, wo die verborgenen Stämme ruhen, im Erdzweig direkt unter dem Tagesmeister. Ausdruck ist in diesem Chart deshalb etwas, das nach außen hin erkennbar ist, und zugleich etwas, das in der eigenen Säule mitläuft, ohne an der Oberfläche zu stehen. Wiederzuerkennen ist das etwa dort, wo eine kritische Anmerkung bereits innerlich formuliert ist, bevor sie ausgesprochen wird, und ebenso dort, wo sie offen auf dem Tisch liegt und eine bestehende Fassung verändert.",
          "factRefs": ["chart.natal.pillar.day.hiddenStem.0.tenGod", "chart.natal.pillar.month.tenGod"],
          "claimRefs": ["claim.sha256:fcbe1320f16008b6ec8dd8139bd287bb9888f409e7aed467210c7df5a6131375"]
        },
        {
          "kind": "INTERPRETATION",
          "posture": "SUPPORTED",
          "text": "Weil Xin der Blickpunkt des Charts ist, ist die Disruptive Ausgabe hier keine Größe, die von irgendwoher kommt, sondern eine Bewegung, die vom Tagesmeister ausgeht. Der Blickpunkt bestimmt die Richtung: Was in der Monatssäule und im Tageszweig als differenzierender Ausdruck erscheint, ist Ausdruck von Xin, nicht Ausdruck über Xin. Das gibt ihm seine Richtung. Es geht um das, was aus diesem Standpunkt heraus hervortritt, etwa in einem Moment, in dem eine Unterscheidung getroffen wird, die nur von genau dieser Stelle aus sichtbar war.",
          "factRefs": ["chart.dayMaster.stem", "chart.natal.pillar.day.hiddenStem.0.tenGod", "chart.natal.pillar.month.tenGod"],
          "claimRefs": ["claim.sha256:dfaed59cf78e966e9a7fa3840b7f86df2d9425b9dba64d7db48dd21ee6d7ad57", "claim.sha256:fcbe1320f16008b6ec8dd8139bd287bb9888f409e7aed467210c7df5a6131375"]
        },
        {
          "kind": "REFLECTION",
          "posture": "SUPPORTED",
          "text": "Wann hast du zuletzt bemerkt, dass ein Gedanke erst dann Kontur bekam, als du ihn von einer vorhandenen Fassung abgesetzt hast – und war dieser Unterschied nach außen sichtbar oder zunächst nur für dich selbst klar?",
          "factRefs": [],
          "claimRefs": ["claim.sha256:fcbe1320f16008b6ec8dd8139bd287bb9888f409e7aed467210c7df5a6131375"]
        }
      ],
      "semanticDelta": [